{
  "$schema": "https://json-schema.org/draft/2020-12/schema",
  "$id": "https://github.com/Ganador1/amy/experiments/verifiable_release_study/schemas/manifest-production-v0.2.schema.json",
  "title": "A.M.Y production verifiable scientific release manifest",
  "type": "object",
  "additionalProperties": false,
  "required": ["schema_version", "release", "build_metadata", "payloads"],
  "properties": {
    "schema_version": {"const": "0.2.0-draft"},
    "release": {
      "type": "object",
      "additionalProperties": false,
      "required": ["id", "version", "kind"],
      "properties": {
        "id": {"type": "string", "pattern": "^[a-z0-9][a-z0-9._-]{0,127}$"},
        "version": {"type": "string", "pattern": "^(?:0|[1-9][0-9]*)\\.(?:0|[1-9][0-9]*)\\.(?:0|[1-9][0-9]*)(?:-[0-9A-Za-z.-]+)?(?:\\+[0-9A-Za-z.-]+)?$"},
        "kind": {
          "enum": [
            "benchmark_case",
            "scientific_paper",
            "model_artifact",
            "model_exchange",
            "software_release",
            "mixed_research_release"
          ]
        }
      }
    },
    "build_metadata": {"$ref": "#/$defs/buildMetadata"},
    "payloads": {
      "type": "array",
      "minItems": 1,
      "maxItems": 10000,
      "items": {"$ref": "#/$defs/payload"}
    }
  },
  "$defs": {
    "sha256": {"type": "string", "pattern": "^[0-9a-f]{64}$"},
    "payloadPath": {
      "type": "string",
      "minLength": 9,
      "maxLength": 240,
      "pattern": "^payload/[^\\u0000]+$"
    },
    "gitObject": {
      "type": "string",
      "pattern": "^(?:[0-9a-f]{40}|[0-9a-f]{64})$"
    },
    "buildMetadata": {
      "type": "object",
      "additionalProperties": false,
      "required": [
        "schema_version",
        "assertion_scope",
        "source",
        "dependency_lock",
        "execution_image"
      ],
      "properties": {
        "schema_version": {"const": "amy.build-metadata.v1"},
        "assertion_scope": {
          "const": "workflow-authored-not-independently-certified"
        },
        "source": {
          "type": "object",
          "additionalProperties": false,
          "required": [
            "repository_uri",
            "revision",
            "ref",
            "git_object_format",
            "tree",
            "dirty",
            "snapshot"
          ],
          "properties": {
            "repository_uri": {
              "type": "string",
              "pattern": "^https://github\\.com/[A-Za-z0-9_.-]+/[A-Za-z0-9_.-]+$",
              "maxLength": 255
            },
            "revision": {"$ref": "#/$defs/gitObject"},
            "ref": {
              "type": "string",
              "pattern": "^refs/tags/[A-Za-z0-9][A-Za-z0-9._/-]{0,199}$"
            },
            "git_object_format": {"enum": ["sha1", "sha256"]},
            "tree": {"$ref": "#/$defs/gitObject"},
            "dirty": {"type": "boolean"},
            "snapshot": {
              "type": "object",
              "additionalProperties": false,
              "required": ["path", "sha256", "format", "assurance"],
              "properties": {
                "path": {"$ref": "#/$defs/payloadPath"},
                "sha256": {"$ref": "#/$defs/sha256"},
                "format": {"const": "application/x-tar"},
                "assurance": {
                  "const": "exact-opaque-bytes-no-git-tree-equivalence-claim"
                }
              }
            }
          },
          "allOf": [
            {
              "if": {
                "properties": {"git_object_format": {"const": "sha1"}},
                "required": ["git_object_format"]
              },
              "then": {
                "properties": {
                  "revision": {"pattern": "^[0-9a-f]{40}$"},
                  "tree": {"pattern": "^[0-9a-f]{40}$"}
                }
              }
            },
            {
              "if": {
                "properties": {"git_object_format": {"const": "sha256"}},
                "required": ["git_object_format"]
              },
              "then": {
                "properties": {
                  "revision": {"pattern": "^[0-9a-f]{64}$"},
                  "tree": {"pattern": "^[0-9a-f]{64}$"}
                }
              }
            }
          ]
        },
        "dependency_lock": {
          "type": "object",
          "additionalProperties": false,
          "required": ["path", "sha256"],
          "properties": {
            "path": {"$ref": "#/$defs/payloadPath"},
            "sha256": {"$ref": "#/$defs/sha256"}
          }
        },
        "execution_image": {
          "type": "object",
          "additionalProperties": false,
          "required": ["reference", "digest"],
          "properties": {
            "reference": {
              "type": "string",
              "pattern": "^[a-z0-9.-]+(?::[0-9]+)?/[a-z0-9._/-]+$",
              "maxLength": 255
            },
            "digest": {
              "type": "string",
              "pattern": "^sha256:[0-9a-f]{64}$"
            }
          }
        }
      }
    },
    "payload": {
      "type": "object",
      "additionalProperties": false,
      "required": ["path", "bytes", "sha256", "media_type", "role"],
      "properties": {
        "path": {"$ref": "#/$defs/payloadPath"},
        "bytes": {"type": "integer", "minimum": 0, "maximum": 5368709120},
        "sha256": {"$ref": "#/$defs/sha256"},
        "media_type": {"type": "string", "pattern": "^[a-z0-9][a-z0-9!#$&^_.+-]*/[a-z0-9][a-z0-9!#$&^_.+-]*$", "maxLength": 127},
        "role": {
          "enum": [
            "analysis_code",
            "analysis_output",
            "configuration",
            "environment_lock",
            "evidence_ledger",
            "figure",
            "log",
            "manuscript_render",
            "manuscript_source",
            "model",
            "model_exchange_request",
            "model_exchange_response",
            "model_metadata",
            "prompt",
            "raw_data",
            "source_code",
            "table"
          ]
        }
      }
    }
  }
}
