{"build_metadata":{"assertion_scope":"workflow-authored-not-independently-certified","dependency_lock":{"path":"payload/provenance/dependency.lock","sha256":"dbab12665d98aef021ba64953c61b0ed8a908cfb56a1c01e2fcb4b052b71a2a1"},"execution_image":{"digest":"sha256:dddddddddddddddddddddddddddddddddddddddddddddddddddddddddddddddd","reference":"ghcr.io/amy/selected-profile-fixture"},"schema_version":"amy.build-metadata.v1","source":{"dirty":false,"git_object_format":"sha1","ref":"refs/tags/paper-v0.1.0","repository_uri":"https://github.com/Ganador1/amy","revision":"aaaaaaaaaaaaaaaaaaaaaaaaaaaaaaaaaaaaaaaa","snapshot":{"assurance":"exact-opaque-bytes-no-git-tree-equivalence-claim","format":"application/x-tar","path":"payload/source/source.tar","sha256":"2bc8dc879609cf564b390de1036df57ea3e2dc6f6d16d7529a916d93eb58e8dd"},"tree":"bbbbbbbbbbbbbbbbbbbbbbbbbbbbbbbbbbbbbbbb"}},"payloads":[{"bytes":22,"media_type":"application/octet-stream","path":"payload/fixtures/pair-a.bin","role":"configuration","sha256":"db2b54a47b58b3dc4b68c9a95ec665a998a2ad8943e4a88b611ec955438ae71b"},{"bytes":22,"media_type":"application/octet-stream","path":"payload/fixtures/pair-b.bin","role":"configuration","sha256":"db2b54a47b58b3dc4b68c9a95ec665a998a2ad8943e4a88b611ec955438ae71b"},{"bytes":0,"media_type":"text/plain","path":"payload/logs/empty.log","role":"log","sha256":"e3b0c44298fc1c149afbf4c8996fb92427ae41e4649b934ca495991b7852b855"},{"bytes":81,"media_type":"application/json","path":"payload/model/metadata.json","role":"model_metadata","sha256":"2e2c3f1d28e6d1cd02c7a500b3c4a3eff8d34e3c42a355733260b135ab196800"},{"bytes":2097169,"media_type":"application/octet-stream","path":"payload/model/weights.bin","role":"model","sha256":"bc82ad63b74788f390ac4e4bf8183c336d7d228d5ec61515571b78dc7533b0d5"},{"bytes":12,"media_type":"text/plain","path":"payload/provenance/dependency.lock","role":"environment_lock","sha256":"dbab12665d98aef021ba64953c61b0ed8a908cfb56a1c01e2fcb4b052b71a2a1"},{"bytes":10240,"media_type":"application/x-tar","path":"payload/source/source.tar","role":"source_code","sha256":"2bc8dc879609cf564b390de1036df57ea3e2dc6f6d16d7529a916d93eb58e8dd"}],"release":{"id":"r0-model","kind":"model_artifact","version":"0.1.0-draft.1"},"schema_version":"0.2.0-draft"}