{"build_metadata":{"assertion_scope":"workflow-authored-not-independently-certified","dependency_lock":{"path":"payload/provenance/dependency.lock","sha256":"dbab12665d98aef021ba64953c61b0ed8a908cfb56a1c01e2fcb4b052b71a2a1"},"execution_image":{"digest":"sha256:dddddddddddddddddddddddddddddddddddddddddddddddddddddddddddddddd","reference":"ghcr.io/amy/selected-profile-fixture"},"schema_version":"amy.build-metadata.v1","source":{"dirty":false,"git_object_format":"sha1","ref":"refs/tags/paper-v0.1.0","repository_uri":"https://github.com/Ganador1/amy","revision":"aaaaaaaaaaaaaaaaaaaaaaaaaaaaaaaaaaaaaaaa","snapshot":{"assurance":"exact-opaque-bytes-no-git-tree-equivalence-claim","format":"application/x-tar","path":"payload/source/source.tar","sha256":"2bc8dc879609cf564b390de1036df57ea3e2dc6f6d16d7529a916d93eb58e8dd"},"tree":"bbbbbbbbbbbbbbbbbbbbbbbbbbbbbbbbbbbbbbbb"}},"payloads":[{"bytes":37,"media_type":"text/x-python","path":"payload/analysis/render.py","role":"analysis_code","sha256":"36d6ad731cd8a366a48a6cc5091c0d746825fd8533e93504c4b452fae6287a07"},{"bytes":38,"media_type":"text/csv","path":"payload/data/table-copy.csv","role":"table","sha256":"30c08926504ad668ae8158a775c17c2d2626e56a3330016c4d187fe749a405f1"},{"bytes":38,"media_type":"text/csv","path":"payload/data/table.csv","role":"table","sha256":"30c08926504ad668ae8158a775c17c2d2626e56a3330016c4d187fe749a405f1"},{"bytes":102,"media_type":"text/plain","path":"payload/environment/requirements.lock","role":"environment_lock","sha256":"f28408aac65e7c741e9c4dc436e062a4a0454941024ad6501969ec94d7253102"},{"bytes":44,"media_type":"text/csv","path":"payload/evidence/claims.csv","role":"evidence_ledger","sha256":"4a079f4b4858d7f7b3ae8385518ea6d93aea39c4d4b4b9fbfbd756e400094e78"},{"bytes":130,"media_type":"image/svg+xml","path":"payload/figures/figure.svg","role":"figure","sha256":"e091fe60bfd867daee378ed537db805c40df97dc206f1da684b7fb5076780301"},{"bytes":71,"media_type":"text/markdown","path":"payload/paper/paper.md","role":"manuscript_source","sha256":"219377ff385ae9f540c9d3cc7c433cdb352b6c8ba627dab7b914bb92ca55dbd6"},{"bytes":673,"media_type":"application/pdf","path":"payload/paper/paper.pdf","role":"manuscript_render","sha256":"434009b981b606b2894b493e9acc05f6981792e561a3fae583341f2c11f1bab2"},{"bytes":12,"media_type":"text/plain","path":"payload/provenance/dependency.lock","role":"environment_lock","sha256":"dbab12665d98aef021ba64953c61b0ed8a908cfb56a1c01e2fcb4b052b71a2a1"},{"bytes":31,"media_type":"application/json","path":"payload/results/analysis.json","role":"analysis_output","sha256":"1916a7f05f9a65b6f59769e3ecedd080056d7d05a9f37798b81366b36c6194e8"},{"bytes":10240,"media_type":"application/x-tar","path":"payload/source/source.tar","role":"source_code","sha256":"2bc8dc879609cf564b390de1036df57ea3e2dc6f6d16d7529a916d93eb58e8dd"}],"release":{"id":"r0-paper","kind":"scientific_paper","version":"0.1.0-draft.1"},"schema_version":"0.2.0-draft"}