{"build_metadata":{"assertion_scope":"workflow-authored-not-independently-certified","dependency_lock":{"path":"payload/provenance/dependency.lock","sha256":"dbab12665d98aef021ba64953c61b0ed8a908cfb56a1c01e2fcb4b052b71a2a1"},"execution_image":{"digest":"sha256:dddddddddddddddddddddddddddddddddddddddddddddddddddddddddddddddd","reference":"ghcr.io/amy/selected-profile-fixture"},"schema_version":"amy.build-metadata.v1","source":{"dirty":false,"git_object_format":"sha1","ref":"refs/tags/paper-v0.1.0","repository_uri":"https://github.com/Ganador1/amy","revision":"aaaaaaaaaaaaaaaaaaaaaaaaaaaaaaaaaaaaaaaa","snapshot":{"assurance":"exact-opaque-bytes-no-git-tree-equivalence-claim","format":"application/x-tar","path":"payload/source/source.tar","sha256":"2bc8dc879609cf564b390de1036df57ea3e2dc6f6d16d7529a916d93eb58e8dd"},"tree":"bbbbbbbbbbbbbbbbbbbbbbbbbbbbbbbbbbbbbbbb"}},"payloads":[{"bytes":116,"media_type":"text/x-python","path":"payload/analysis/analyze.py","role":"analysis_code","sha256":"3f7070979468c359de078075d8eeaf91c7185e2bb5cac855b5b2c91dd3b487bb"},{"bytes":21,"media_type":"text/csv","path":"payload/data/observations-copy.csv","role":"raw_data","sha256":"983a9e28149cbb116096e13553e2a863bfd79c339ae7addf6bd306a943868671"},{"bytes":21,"media_type":"text/csv","path":"payload/data/observations.csv","role":"raw_data","sha256":"983a9e28149cbb116096e13553e2a863bfd79c339ae7addf6bd306a943868671"},{"bytes":182,"media_type":"image/svg+xml","path":"payload/figures/result.svg","role":"figure","sha256":"d18a4fdaa8313606c629d82914f1e5770ec424a91db556282827bb2d641825fe"},{"bytes":0,"media_type":"text/plain","path":"payload/notes/empty.txt","role":"configuration","sha256":"e3b0c44298fc1c149afbf4c8996fb92427ae41e4649b934ca495991b7852b855"},{"bytes":12,"media_type":"text/plain","path":"payload/provenance/dependency.lock","role":"environment_lock","sha256":"dbab12665d98aef021ba64953c61b0ed8a908cfb56a1c01e2fcb4b052b71a2a1"},{"bytes":41,"media_type":"application/json","path":"payload/results/summary.json","role":"analysis_output","sha256":"4ef643a9749d8dbd5183e46cabb70ce988d2f02ba5c746ef87cae3b99071356c"},{"bytes":10240,"media_type":"application/x-tar","path":"payload/source/source.tar","role":"source_code","sha256":"2bc8dc879609cf564b390de1036df57ea3e2dc6f6d16d7529a916d93eb58e8dd"}],"release":{"id":"r0-tabular","kind":"benchmark_case","version":"0.1.0-draft.1"},"schema_version":"0.2.0-draft"}