{"build_metadata":{"assertion_scope":"workflow-authored-not-independently-certified","dependency_lock":{"path":"payload/provenance/dependency.lock","sha256":"dbab12665d98aef021ba64953c61b0ed8a908cfb56a1c01e2fcb4b052b71a2a1"},"execution_image":{"digest":"sha256:dddddddddddddddddddddddddddddddddddddddddddddddddddddddddddddddd","reference":"ghcr.io/amy/selected-profile-fixture"},"schema_version":"amy.build-metadata.v1","source":{"dirty":false,"git_object_format":"sha1","ref":"refs/tags/paper-v0.1.0","repository_uri":"https://github.com/Ganador1/amy","revision":"aaaaaaaaaaaaaaaaaaaaaaaaaaaaaaaaaaaaaaaa","snapshot":{"assurance":"exact-opaque-bytes-no-git-tree-equivalence-claim","format":"application/x-tar","path":"payload/source/source.tar","sha256":"2bc8dc879609cf564b390de1036df57ea3e2dc6f6d16d7529a916d93eb58e8dd"},"tree":"bbbbbbbbbbbbbbbbbbbbbbbbbbbbbbbbbbbbbbbb"}},"payloads":[{"bytes":34,"media_type":"application/json","path":"payload/config/default.json","role":"configuration","sha256":"730ed338db99202d277baaab3e8e51906f25e88ec2036415263b218220ed854f"},{"bytes":58,"media_type":"text/plain","path":"payload/environment/uv.lock","role":"environment_lock","sha256":"3e69e537fc82e750a03d0811b7091aaba310c66f69843f96fe9a7c043a4c20c6"},{"bytes":22,"media_type":"text/plain","path":"payload/fixtures/pair-a.txt","role":"configuration","sha256":"db2b54a47b58b3dc4b68c9a95ec665a998a2ad8943e4a88b611ec955438ae71b"},{"bytes":22,"media_type":"text/plain","path":"payload/fixtures/pair-b.txt","role":"configuration","sha256":"db2b54a47b58b3dc4b68c9a95ec665a998a2ad8943e4a88b611ec955438ae71b"},{"bytes":12,"media_type":"text/plain","path":"payload/provenance/dependency.lock","role":"environment_lock","sha256":"dbab12665d98aef021ba64953c61b0ed8a908cfb56a1c01e2fcb4b052b71a2a1"},{"bytes":10240,"media_type":"application/x-tar","path":"payload/source/source.tar","role":"source_code","sha256":"2bc8dc879609cf564b390de1036df57ea3e2dc6f6d16d7529a916d93eb58e8dd"},{"bytes":70,"media_type":"text/x-python","path":"payload/src/lib/normalize.py","role":"source_code","sha256":"eece8c2b38099a2ff29d4dc291d740bafde928f692502c5605a23552ce5f31ac"},{"bytes":66,"media_type":"text/x-python","path":"payload/src/main.py","role":"source_code","sha256":"e89d5c28ca52401c35ec18560b1f61768ed291d3941735ea7d2bc31cc77978ce"}],"release":{"id":"r0-software","kind":"software_release","version":"0.1.0-draft.1"},"schema_version":"0.2.0-draft"}