{"build_metadata":{"assertion_scope":"workflow-authored-not-independently-certified","dependency_lock":{"path":"payload/provenance/dependency.lock","sha256":"dbab12665d98aef021ba64953c61b0ed8a908cfb56a1c01e2fcb4b052b71a2a1"},"execution_image":{"digest":"sha256:dddddddddddddddddddddddddddddddddddddddddddddddddddddddddddddddd","reference":"ghcr.io/amy/selected-profile-fixture"},"schema_version":"amy.build-metadata.v1","source":{"dirty":false,"git_object_format":"sha1","ref":"refs/tags/paper-v0.1.0","repository_uri":"https://github.com/Ganador1/amy","revision":"aaaaaaaaaaaaaaaaaaaaaaaaaaaaaaaaaaaaaaaa","snapshot":{"assurance":"exact-opaque-bytes-no-git-tree-equivalence-claim","format":"application/x-tar","path":"payload/source/source.tar","sha256":"2bc8dc879609cf564b390de1036df57ea3e2dc6f6d16d7529a916d93eb58e8dd"},"tree":"bbbbbbbbbbbbbbbbbbbbbbbbbbbbbbbbbbbbbbbb"}},"payloads":[{"bytes":32,"media_type":"text/x-python","path":"payload/analysis/run.py","role":"analysis_code","sha256":"b30410eba5b1da97a8093d0bb86f44307955e2be38edc3748848e1941159a614"},{"bytes":16,"media_type":"text/csv","path":"payload/data/input-copy.csv","role":"raw_data","sha256":"d625c4bc6e1804a94d1d5231b91f80bc2e8c9246e7d960d24b382345af850329"},{"bytes":16,"media_type":"text/csv","path":"payload/data/input.csv","role":"raw_data","sha256":"d625c4bc6e1804a94d1d5231b91f80bc2e8c9246e7d960d24b382345af850329"},{"bytes":27,"media_type":"text/plain","path":"payload/deep/one/two/three/audit.log","role":"log","sha256":"89d67ef36a2ee9e5eac2e7e1f0384bef842cedfff1fe35ff7df5ec3cb0add591"},{"bytes":16,"media_type":"text/plain","path":"payload/environment/requirements.lock","role":"environment_lock","sha256":"11ff38a4277bfe339c37accd9be71ac9c014f2e21a551f124f2b06ed8f7864c7"},{"bytes":56,"media_type":"text/csv","path":"payload/evidence/ledger.csv","role":"evidence_ledger","sha256":"fcfd3ef1599015a10d7320d2ce16768b20e124597061135f800af0b09218e2ab"},{"bytes":55,"media_type":"text/markdown","path":"payload/manuscript/note.md","role":"manuscript_source","sha256":"08b6f1ef3985499b74e2076e50dd8c29d72b976e528ae40c7c8d0c54da0599d8"},{"bytes":12,"media_type":"text/plain","path":"payload/provenance/dependency.lock","role":"environment_lock","sha256":"dbab12665d98aef021ba64953c61b0ed8a908cfb56a1c01e2fcb4b052b71a2a1"},{"bytes":1048577,"media_type":"application/octet-stream","path":"payload/results/large-output.bin","role":"analysis_output","sha256":"b0f3cf2213a45f0fa1a0b3f0791ebb0ba833c3f80c93849cef99da1595607eb5"},{"bytes":33,"media_type":"application/json","path":"payload/results/result.json","role":"analysis_output","sha256":"0511afdcf96f0faa23c31b9197eb2f2a098adb28a83ef946319a4c6ed2ef67ca"},{"bytes":10240,"media_type":"application/x-tar","path":"payload/source/source.tar","role":"source_code","sha256":"2bc8dc879609cf564b390de1036df57ea3e2dc6f6d16d7529a916d93eb58e8dd"}],"release":{"id":"r0-mixed-research","kind":"mixed_research_release","version":"0.1.0-draft.1"},"schema_version":"0.2.0-draft"}