{"build_metadata":{"assertion_scope":"workflow-authored-not-independently-certified","dependency_lock":{"path":"payload/provenance/dependency.lock","sha256":"dbab12665d98aef021ba64953c61b0ed8a908cfb56a1c01e2fcb4b052b71a2a1"},"execution_image":{"digest":"sha256:dddddddddddddddddddddddddddddddddddddddddddddddddddddddddddddddd","reference":"ghcr.io/amy/selected-profile-fixture"},"schema_version":"amy.build-metadata.v1","source":{"dirty":false,"git_object_format":"sha1","ref":"refs/tags/paper-v0.1.0","repository_uri":"https://github.com/Ganador1/amy","revision":"aaaaaaaaaaaaaaaaaaaaaaaaaaaaaaaaaaaaaaaa","snapshot":{"assurance":"exact-opaque-bytes-no-git-tree-equivalence-claim","format":"application/x-tar","path":"payload/source/source.tar","sha256":"2bc8dc879609cf564b390de1036df57ea3e2dc6f6d16d7529a916d93eb58e8dd"},"tree":"bbbbbbbbbbbbbbbbbbbbbbbbbbbbbbbbbbbbbbbb"}},"payloads":[{"bytes":96,"media_type":"application/json","path":"payload/exchange/metadata.json","role":"model_metadata","sha256":"2e6cb537a9d7cc9f934fbfc9a9122248860836ac03bc2108040483defb2e6c39"},{"bytes":92,"media_type":"application/json","path":"payload/exchange/request.json","role":"model_exchange_request","sha256":"1948bb3e419d66da5099e7b48b0d76269497fff969d8d4dc65b51e764752571a"},{"bytes":83,"media_type":"application/json","path":"payload/exchange/response.json","role":"model_exchange_response","sha256":"472142346da2de0727c8c66561d07e1b08ff45db7e976e66b8c04f708980eb6d"},{"bytes":22,"media_type":"text/plain","path":"payload/fixtures/pair-a.txt","role":"configuration","sha256":"db2b54a47b58b3dc4b68c9a95ec665a998a2ad8943e4a88b611ec955438ae71b"},{"bytes":22,"media_type":"text/plain","path":"payload/fixtures/pair-b.txt","role":"configuration","sha256":"db2b54a47b58b3dc4b68c9a95ec665a998a2ad8943e4a88b611ec955438ae71b"},{"bytes":68,"media_type":"text/plain","path":"payload/prompt/system.txt","role":"prompt","sha256":"e1bddfa9eefad4c8f0af8f0056547216571f13c5445956dd2e8a16b46ff0a3f4"},{"bytes":12,"media_type":"text/plain","path":"payload/provenance/dependency.lock","role":"environment_lock","sha256":"dbab12665d98aef021ba64953c61b0ed8a908cfb56a1c01e2fcb4b052b71a2a1"},{"bytes":10240,"media_type":"application/x-tar","path":"payload/source/source.tar","role":"source_code","sha256":"2bc8dc879609cf564b390de1036df57ea3e2dc6f6d16d7529a916d93eb58e8dd"}],"release":{"id":"r0-model-exchange","kind":"model_exchange","version":"0.1.0-draft.1"},"schema_version":"0.2.0-draft"}